{
  "schema": "sensor.report.v1",
  "tool": {
    "name": "perfgate",
    "version": "0.1.0"
  },
  "run": {
    "started_at": "2024-01-01T00:00:00Z",
    "ended_at": "2024-01-01T00:01:00Z",
    "duration_ms": 60000,
    "capabilities": {
      "baseline": {
        "status": "available"
      }
    }
  },
  "verdict": {
    "status": "warn",
    "counts": {
      "info": 1,
      "warn": 1,
      "error": 0
    },
    "reasons": ["wall_ms_warn"]
  },
  "findings": [
    {
      "check_id": "perf.budget",
      "code": "metric_warn",
      "severity": "warn",
      "message": "wall_ms regression: +15.00% (threshold: 20.0%)",
      "data": {
        "metric_name": "wall_ms",
        "baseline": 1000.0,
        "current": 1150.0,
        "regression_pct": 15.0,
        "threshold": 0.2,
        "direction": "lower"
      }
    }
  ],
  "artifacts": [
    {
      "path": "extras/perfgate.compare.v1.json",
      "type": "compare_receipt"
    },
    {
      "path": "comment.md",
      "type": "markdown"
    },
    {
      "path": "extras/perfgate.report.v1.json",
      "type": "perfgate_report"
    },
    {
      "path": "extras/perfgate.run.v1.json",
      "type": "run_receipt"
    }
  ],
  "data": {
    "summary": {
      "pass_count": 1,
      "warn_count": 1,
      "fail_count": 0,
      "total_count": 2
    }
  }
}
